{
  "schemaVersion": 1,
  "id": "v2-image-canva-packaging-system-hero",
  "content": {
    "title": "Canva Magic Media · 包装系列展示 · 主视觉版",
    "summary": "Canva Magic Media 适用的「包装系列展示」主视觉版：生成同一虚构品牌下多规格包装陈列，强调系列感和可读标签，包含复制即用正文、可替换关键词、平台参数、失败修正和安全边界。",
    "preview": "",
    "prompt": "请使用 Canva Magic Media 生成一张「包装系列展示」图片。画面主体是 {品类}，使用场景为 {包装规格}，重点呈现 {品牌气质}，整体风格、情绪和色彩氛围为 {标签文字}，采用 {画面比例} 构图。主体居中，第一眼识别产品或角色，适合首页和广告首图。 构图需要有清晰视觉中心、前中后景层次、可见材质细节、可控光影和后期排版留白。文字只允许出现用户明确填写的短句，其他区域保持无文字。输出必须商业安全、原创、可直接用于图片生成。",
    "copyPrompt": "",
    "language": "zh-CN"
  },
  "classification": {
    "category": "图像提示词 / Canva",
    "department": "",
    "scenario": "",
    "task": "",
    "modality": "图像",
    "useCase": "包装系列展示",
    "aspectRatio": "{画面比例}",
    "difficulty": "进阶",
    "tags": [
      "工具:Canva Magic Media",
      "模态:图像",
      "用途:包装系列展示",
      "难度:进阶",
      "官方结构参考:否",
      "一键复制模板",
      "可替换关键词",
      "图片视频生成",
      "canva",
      "packaging-system"
    ],
    "styleTags": [],
    "seoKeywords": [
      "图像",
      "Canva Magic Media",
      "包装系列展示",
      "图像提示词",
      "Canva",
      "工具:Canva Magic Media",
      "模态:图像",
      "用途:包装系列展示",
      "难度:进阶",
      "官方结构参考:否"
    ]
  },
  "model": {
    "tool": "Canva Magic Media",
    "name": "canva"
  },
  "variables": {
    "names": [
      "{品类}",
      "{包装规格}",
      "{品牌气质}",
      "{标签文字}",
      "{陈列方式}",
      "{画面比例}",
      "{主色}",
      "{材质}",
      "{目标平台}",
      "{输出格式}"
    ],
    "defaults": {
      "品类": "待定",
      "包装规格": "待定",
      "品牌气质": "待定",
      "标签文字": "待定",
      "陈列方式": "待定",
      "画面比例": "4:5",
      "主色": "待定",
      "材质": "磨砂金属与半透明玻璃",
      "目标平台": "待定",
      "输出格式": "待定"
    }
  },
  "provenance": {
    "source": "v2 5000 visual copy-ready templates / original platform-adapted library",
    "authorName": "",
    "authorUrl": "",
    "sourceUrl": "",
    "licenseType": "",
    "licenseConfirmed": false,
    "submissionIssueNumber": null
  },
  "proof": null,
  "publication": {
    "status": "published",
    "featured": false,
    "copyReady": true,
    "qualityScore": 90,
    "qualityLevel": "professional",
    "verifiedAt": "2026-05-21",
    "collectionIds": [],
    "createdAt": "",
    "updatedAt": "",
    "publishedAt": ""
  }
}
