{
  "schemaVersion": 1,
  "id": "cinematic-single-panel-image-004",
  "content": {
    "title": "影视导演工作台 · 单张场景剧照",
    "summary": "单张场景剧照模板，覆盖主体、场景、镜头、光影、色彩、情绪、画幅和负面约束，可复制中文、英文、Midjourney、视频版和负面词。",
    "preview": "",
    "prompt": "单张场景剧照，请生成一张可直接用于商业安全创作的电影感图像。主体为都市女企业家，位于高层办公室与城市夜景，穿着或携带白色衬衫、深色西装、银色腕表，动作和表情保持克制但有明确戏剧动机。使用大远景，门框构图，50mm 中近景，构图有清晰视觉中心和前中后景层次。光影为蓝调时刻，色彩为低饱和，情绪是紧张，整体风格为商业大片质感。背景只服务主体，不堆砌无关装饰；皮肤、布料、金属、雨水或玻璃反光要真实；眼神清晰，手部自然，身份稳定。输出为 1:1，画面不要文字、不要水印、不要可识别品牌标识、不要真人肖像冒用。质量标准：主体完整、景别准确、光线统一、色彩可控、情绪明确、可直接复制到图像模型使用。",
    "copyPrompt": "",
    "language": "bilingual"
  },
  "classification": {
    "category": "影视提示词 / 单宫格图片",
    "department": "",
    "scenario": "",
    "task": "",
    "modality": "图像",
    "useCase": "单张电影海报与剧照",
    "aspectRatio": "1:1",
    "difficulty": "进阶",
    "tags": [
      "工具:Google Veo",
      "模态:图像",
      "用途:单张电影海报与剧照",
      "难度:进阶",
      "影视提示词",
      "电影感",
      "变量替换",
      "一键复制",
      "single-panel-image"
    ],
    "styleTags": [
      "商业大片质感",
      "单张电影海报与剧照",
      "单张场景剧照"
    ],
    "seoKeywords": [
      "图像",
      "Google Veo",
      "单张电影海报与剧照",
      "影视提示词",
      "单宫格图片",
      "工具:Google Veo",
      "模态:图像",
      "用途:单张电影海报与剧照",
      "难度:进阶",
      "电影感"
    ]
  },
  "model": {
    "tool": "Google Veo",
    "name": "veo"
  },
  "variables": {
    "names": [
      "{subject}",
      "{scene}",
      "{mood}",
      "{clothing}",
      "{lighting}",
      "{camera}",
      "{aspectRatio}",
      "{style}"
    ],
    "defaults": {
      "subject": "都市女企业家",
      "scene": "高层办公室与城市夜景",
      "mood": "冷静、决断、疏离",
      "clothing": "白色衬衫、深色西装、银色腕表",
      "lighting": "窗边柔光与城市霓虹边缘光",
      "camera": "50mm 中近景",
      "style": "商业大片质感",
      "aspectRatio": "1:1"
    }
  },
  "provenance": {
    "source": "原创影视提示词导演工作台 / 官方结构参考",
    "authorName": "",
    "authorUrl": "",
    "sourceUrl": "",
    "licenseType": "",
    "licenseConfirmed": false,
    "submissionIssueNumber": null
  },
  "proof": {
    "assetPath": "proofs/generated/cinematic-single-panel-image-004.webp",
    "type": "GPT Image 效果预览",
    "model": "ChatGPT web / GPT Image",
    "testedAt": "2026-05-21",
    "resultNote": "预览图来自 public/proofs/generated，按提示词 ID 精确匹配。",
    "evidenceLevel": "generated-preview"
  },
  "publication": {
    "status": "published-proofed",
    "featured": true,
    "copyReady": true,
    "qualityScore": 92,
    "qualityLevel": "usable",
    "verifiedAt": "2026-05-21",
    "collectionIds": [],
    "createdAt": "",
    "updatedAt": "",
    "publishedAt": ""
  }
}
