{
  "schemaVersion": 1,
  "id": "v2-video-kling-festival-ad-image-to-video",
  "content": {
    "title": "可灵 Kling · 节日品牌短片 · 图生视频版",
    "summary": "可灵 Kling 适用的「节日品牌短片」图生视频版：生成克制的节日品牌问候或促销氛围短片，包含复制即用正文、可替换关键词、平台参数、失败修正和安全边界。",
    "preview": "",
    "prompt": "请使用 可灵 Kling 生成一段「节日品牌短片」视频。主体是 {节日}，发生在 {品牌气质}，核心动作围绕 {主体} 展开，镜头使用 {场景} 或同等稳定运镜，画幅为 {比例}。把首帧作为构图和主体依据，只描述运动和环境变化。 前 3 秒交代主体和目标，中段展示动作变化，结尾停在可作为封面的稳定画面。保持主体、服装、道具、产品外观、光线和空间方向一致；不要突然切换场景、不要身份漂移、不要生成随机文字。",
    "copyPrompt": "",
    "language": "zh-CN"
  },
  "classification": {
    "category": "视频提示词 / 可灵",
    "department": "",
    "scenario": "",
    "task": "",
    "modality": "视频",
    "useCase": "节日品牌短片",
    "aspectRatio": "{画面比例}",
    "difficulty": "进阶",
    "tags": [
      "工具:可灵 Kling",
      "模态:视频",
      "用途:节日品牌短片",
      "难度:进阶",
      "官方结构参考:否",
      "一键复制模板",
      "可替换关键词",
      "图片视频生成",
      "kling",
      "festival-ad"
    ],
    "styleTags": [],
    "seoKeywords": [
      "视频",
      "可灵 Kling",
      "节日品牌短片",
      "视频提示词",
      "可灵",
      "工具:可灵 Kling",
      "模态:视频",
      "用途:节日品牌短片",
      "难度:进阶",
      "官方结构参考:否"
    ]
  },
  "model": {
    "tool": "可灵 Kling",
    "name": "kling"
  },
  "variables": {
    "names": [
      "{节日}",
      "{品牌气质}",
      "{主体}",
      "{场景}",
      "{镜头}",
      "{比例}",
      "{文案}",
      "{结尾}",
      "{时长}",
      "{输出格式}"
    ],
    "defaults": {
      "节日": "待定",
      "品牌气质": "待定",
      "主体": "原创成年角色与产品",
      "场景": "夜晚书桌",
      "镜头": "缓慢推进",
      "比例": "9:16",
      "文案": "待定",
      "结尾": "待定",
      "时长": "8 秒",
      "输出格式": "待定"
    }
  },
  "provenance": {
    "source": "v2 5000 visual copy-ready templates / original platform-adapted library",
    "authorName": "",
    "authorUrl": "",
    "sourceUrl": "",
    "licenseType": "",
    "licenseConfirmed": false,
    "submissionIssueNumber": null
  },
  "proof": null,
  "publication": {
    "status": "published",
    "featured": false,
    "copyReady": true,
    "qualityScore": 92,
    "qualityLevel": "professional",
    "verifiedAt": "2026-05-21",
    "collectionIds": [],
    "createdAt": "",
    "updatedAt": "",
    "publishedAt": ""
  }
}
