{
  "schemaVersion": 1,
  "id": "community-task-growth-ads-data-retention-analysis-winback-plan",
  "content": {
    "title": "社区分享 · 增长 / 投放 / 数据分析 · 留存分析 · 生成召回策略",
    "summary": "面向「增长 / 投放 / 数据分析 / 留存分析」的社区分享提示词，可直接用于「生成召回策略」任务。",
    "preview": "",
    "prompt": "适用工具：ChatGPT / Gemini\n适用场景：增长 / 投放 / 数据分析 / 留存分析 / 生成召回策略\n输入变量：{{主题/对象}}、{{目标受众}}、{{使用场景}}、{{约束条件}}、{{输出格式}}、{{数据字段}}、{{判断口径}}\n\n复制即用提示词：\n你是一名熟悉中文互联网业务的 AI 提示词助手，请基于我给出的资料完成「生成召回策略」任务。\n\n任务背景：\n- 所属分类：增长 / 投放 / 数据分析\n- 当前场景：留存分析\n- 目标任务：生成召回策略\n- 主题或对象：{{主题/对象}}\n- 目标受众：{{目标受众}}\n- 使用场景：{{使用场景}}\n- 限制条件：{{约束条件}}\n\n执行步骤：\n1. 先复述你理解的任务目标，指出还缺哪些关键信息；如果信息不足，用合理假设补齐并标注“假设”。\n2. 根据「留存分析」的常见工作流程，拆成 3 到 6 个可执行步骤，不要只给空泛建议。\n3. 围绕「生成召回策略」产出可直接使用的成品内容，内容要具体、有场景、有判断标准。\n4. 如果涉及内容、营销、销售、产品或运营，不夸大效果，不使用绝对化承诺，不冒用真实品牌或名人。\n5. 如果涉及数据或复盘，区分事实、推断和下一步验证，不把相关性写成因果结论。\n\n输出格式：\n输出一份可直接交给 AI 执行的中文工作提示词，必须包含角色设定、任务背景、执行步骤、交付格式、判断标准和失败修正。\n请按以下结构输出：\n- 任务理解\n- 输入信息整理\n- 可直接使用的成品\n- 可替换变量\n- 检查清单\n- 常见失败点\n- 下一步优化建议\n\n质量标准：\n- 结果必须能复制后直接使用，不能只写“建议你优化”。\n- 内容必须符合中文表达习惯，短句优先，避免堆砌黑话。\n- 每个结论都要能追溯到输入变量或明确假设。\n- 输出格式稳定，便于用户继续改写、复制或发布到社区。\n\n参数/设置建议：\n- 如果用于 ChatGPT、DeepSeek、Claude 或 Gemini，先粘贴完整背景，再补充真实资料。\n- 如果用于图像或视频工具，请把主体、场景、镜头、动作、风格、比例和负面约束拆开写。\n- 如果结果过泛，追加“请给出 3 个不同版本，并说明适用场景”。\n\n迭代方法：\n- 第一轮先要结构和方向，第二轮补充真实资料，第三轮要求压缩成可发布版本。\n- 对不满意的部分，不要整段重写，指出具体问题：太长、太虚、缺少卖点、语气不对或格式不稳定。\n\n常见失败修正：\n- 如果输出太空泛：要求加入具体对象、平台、受众、约束和例子。\n- 如果输出太像广告：要求降低承诺、补充证据和风险提醒。\n- 如果输出不可复制：要求改成固定栏目、表格或编号清单。\n\n边界提醒：\n- 不复制第三方提示词原文，不冒用真实品牌、名人、受保护 IP 或私密资料。\n- 不生成违法、欺诈、规避审核、医疗诊断、金融收益承诺或侵犯隐私的内容。\n- 本提示词用于社区免费分享和学习，发布前请根据真实业务再检查一遍。",
    "copyPrompt": "",
    "language": "zh-CN"
  },
  "classification": {
    "category": "增长 / 投放 / 数据分析 / 留存分析 / 生成召回策略",
    "department": "",
    "scenario": "",
    "task": "",
    "modality": "文本",
    "useCase": "生成召回策略",
    "aspectRatio": "",
    "difficulty": "入门",
    "tags": [
      "工具:ChatGPT / Gemini",
      "模态:文本",
      "用途:生成召回策略",
      "难度:入门",
      "社区分享",
      "免费复制",
      "原创种子"
    ],
    "styleTags": [],
    "seoKeywords": [
      "文本",
      "ChatGPT / Gemini",
      "生成召回策略",
      "增长",
      "投放",
      "数据分析",
      "留存分析",
      "工具:ChatGPT / Gemini",
      "模态:文本",
      "用途:生成召回策略"
    ]
  },
  "model": {
    "tool": "ChatGPT / Gemini",
    "name": "universal"
  },
  "variables": {
    "names": [
      "{主题/对象}",
      "{目标受众}",
      "{使用场景}",
      "{约束条件}",
      "{输出格式}",
      "{数据字段}",
      "{判断口径}"
    ],
    "defaults": {}
  },
  "provenance": {
    "source": "站内原创生成种子，不复制外部提示词原文",
    "authorName": "",
    "authorUrl": "",
    "sourceUrl": "",
    "licenseType": "",
    "licenseConfirmed": false,
    "submissionIssueNumber": null
  },
  "proof": null,
  "publication": {
    "status": "published",
    "featured": false,
    "copyReady": true,
    "qualityScore": 98,
    "qualityLevel": "professional",
    "verifiedAt": "2026-05-24",
    "collectionIds": [],
    "createdAt": "",
    "updatedAt": "",
    "publishedAt": ""
  }
}
