{
  "schemaVersion": 1,
  "id": "v2-video-sora-training-explainer-single-shot",
  "content": {
    "title": "Sora · 培训说明短片 · 单镜头版",
    "summary": "Sora 适用的「培训说明短片」单镜头版：把复杂流程拆成可视化步骤，适合员工培训，包含复制即用正文、可替换关键词、平台参数、失败修正和安全边界。",
    "preview": "",
    "prompt": "请使用 Sora 生成一段「培训说明短片」视频。主体是 {培训主题}，发生在 {步骤}，核心动作围绕 {角色} 展开，镜头使用 {场景} 或同等稳定运镜，画幅为 {输出比例}。一个连续镜头完成动作，减少跳帧和身份漂移。 前 3 秒交代主体和目标，中段展示动作变化，结尾停在可作为封面的稳定画面。保持主体、服装、道具、产品外观、光线和空间方向一致；不要突然切换场景、不要身份漂移、不要生成随机文字。",
    "copyPrompt": "",
    "language": "zh-CN"
  },
  "classification": {
    "category": "视频提示词 / Sora",
    "department": "",
    "scenario": "",
    "task": "",
    "modality": "视频",
    "useCase": "培训说明短片",
    "aspectRatio": "{画面比例}",
    "difficulty": "入门",
    "tags": [
      "工具:Sora",
      "模态:视频",
      "用途:培训说明短片",
      "难度:入门",
      "官方结构参考:否",
      "一键复制模板",
      "可替换关键词",
      "图片视频生成",
      "sora",
      "training-explainer"
    ],
    "styleTags": [],
    "seoKeywords": [
      "视频",
      "Sora",
      "培训说明短片",
      "视频提示词",
      "工具:Sora",
      "模态:视频",
      "用途:培训说明短片",
      "难度:入门",
      "官方结构参考:否",
      "一键复制模板"
    ]
  },
  "model": {
    "tool": "Sora",
    "name": "sora"
  },
  "variables": {
    "names": [
      "{培训主题}",
      "{步骤}",
      "{角色}",
      "{场景}",
      "{输出比例}",
      "{图标}",
      "{旁白}",
      "{节奏}",
      "{时长}",
      "{输出格式}"
    ],
    "defaults": {
      "培训主题": "待定",
      "步骤": "待定",
      "角色": "待定",
      "场景": "夜晚书桌",
      "输出比例": "待定",
      "图标": "待定",
      "旁白": "待定",
      "节奏": "待定",
      "时长": "8 秒",
      "输出格式": "待定"
    }
  },
  "provenance": {
    "source": "v2 5000 visual copy-ready templates / original platform-adapted library",
    "authorName": "",
    "authorUrl": "",
    "sourceUrl": "",
    "licenseType": "",
    "licenseConfirmed": false,
    "submissionIssueNumber": null
  },
  "proof": null,
  "publication": {
    "status": "published",
    "featured": true,
    "copyReady": true,
    "qualityScore": 92,
    "qualityLevel": "professional",
    "verifiedAt": "2026-05-21",
    "collectionIds": [
      "video-motion-shot"
    ],
    "createdAt": "",
    "updatedAt": "",
    "publishedAt": ""
  }
}
