{
  "schemaVersion": 1,
  "id": "v2-video-luma-finance-explainer-three-act",
  "content": {
    "title": "Luma Dream Machine · 经营指标解释视频 · 三段式版",
    "summary": "Luma Dream Machine 适用的「经营指标解释视频」三段式版：用图形和场景解释指标变化，不做投资建议，包含复制即用正文、可替换关键词、平台参数、失败修正和安全边界。",
    "preview": "",
    "prompt": "请使用 Luma Dream Machine 生成一段「经营指标解释视频」视频。主体是 {指标}，发生在 {业务场景}，核心动作围绕 {变化} 展开，镜头使用 {图表} 或同等稳定运镜，画幅为 {比例}。开头交代问题，中段展示变化，结尾形成可截图的稳定画面。 前 3 秒交代主体和目标，中段展示动作变化，结尾停在可作为封面的稳定画面。保持主体、服装、道具、产品外观、光线和空间方向一致；不要突然切换场景、不要身份漂移、不要生成随机文字。",
    "copyPrompt": "",
    "language": "zh-CN"
  },
  "classification": {
    "category": "视频提示词 / Luma",
    "department": "",
    "scenario": "",
    "task": "",
    "modality": "视频",
    "useCase": "经营指标解释视频",
    "aspectRatio": "{画面比例}",
    "difficulty": "进阶",
    "tags": [
      "工具:Luma Dream Machine",
      "模态:视频",
      "用途:经营指标解释视频",
      "难度:进阶",
      "官方结构参考:否",
      "一键复制模板",
      "可替换关键词",
      "图片视频生成",
      "luma",
      "finance-explainer"
    ],
    "styleTags": [],
    "seoKeywords": [
      "视频",
      "Luma Dream Machine",
      "经营指标解释视频",
      "视频提示词",
      "Luma",
      "工具:Luma Dream Machine",
      "模态:视频",
      "用途:经营指标解释视频",
      "难度:进阶",
      "官方结构参考:否"
    ]
  },
  "model": {
    "tool": "Luma Dream Machine",
    "name": "luma"
  },
  "variables": {
    "names": [
      "{指标}",
      "{业务场景}",
      "{变化}",
      "{图表}",
      "{时长}",
      "{比例}",
      "{旁白}",
      "{边界}",
      "{输出格式}"
    ],
    "defaults": {
      "指标": "待定",
      "业务场景": "待定",
      "变化": "待定",
      "图表": "待定",
      "时长": "8 秒",
      "比例": "9:16",
      "旁白": "待定",
      "边界": "待定",
      "输出格式": "待定"
    }
  },
  "provenance": {
    "source": "v2 5000 visual copy-ready templates / original platform-adapted library",
    "authorName": "",
    "authorUrl": "",
    "sourceUrl": "",
    "licenseType": "",
    "licenseConfirmed": false,
    "submissionIssueNumber": null
  },
  "proof": null,
  "publication": {
    "status": "published",
    "featured": false,
    "copyReady": true,
    "qualityScore": 92,
    "qualityLevel": "professional",
    "verifiedAt": "2026-05-21",
    "collectionIds": [],
    "createdAt": "",
    "updatedAt": "",
    "publishedAt": ""
  }
}
