{
  "schemaVersion": 1,
  "id": "v2-video-kling-kitchen-device-image-to-video",
  "content": {
    "title": "可灵 Kling · 厨房设备演示 · 图生视频版",
    "summary": "可灵 Kling 适用的「厨房设备演示」图生视频版：展示小家电或工具的准备、操作和结果，包含复制即用正文、可替换关键词、平台参数、失败修正和安全边界。",
    "preview": "",
    "prompt": "请使用 可灵 Kling 生成一段「厨房设备演示」视频。主体是 {设备}，发生在 {食材}，核心动作围绕 {操作} 展开，镜头使用 {结果} 或同等稳定运镜，画幅为 {画面比例}。把首帧作为构图和主体依据，只描述运动和环境变化。 前 3 秒交代主体和目标，中段展示动作变化，结尾停在可作为封面的稳定画面。保持主体、服装、道具、产品外观、光线和空间方向一致；不要突然切换场景、不要身份漂移、不要生成随机文字。",
    "copyPrompt": "",
    "language": "zh-CN"
  },
  "classification": {
    "category": "视频提示词 / 可灵",
    "department": "",
    "scenario": "",
    "task": "",
    "modality": "视频",
    "useCase": "厨房设备演示",
    "aspectRatio": "{画面比例}",
    "difficulty": "进阶",
    "tags": [
      "工具:可灵 Kling",
      "模态:视频",
      "用途:厨房设备演示",
      "难度:进阶",
      "官方结构参考:否",
      "一键复制模板",
      "可替换关键词",
      "图片视频生成",
      "kling",
      "kitchen-device"
    ],
    "styleTags": [],
    "seoKeywords": [
      "视频",
      "可灵 Kling",
      "厨房设备演示",
      "视频提示词",
      "可灵",
      "工具:可灵 Kling",
      "模态:视频",
      "用途:厨房设备演示",
      "难度:进阶",
      "官方结构参考:否"
    ]
  },
  "model": {
    "tool": "可灵 Kling",
    "name": "kling"
  },
  "variables": {
    "names": [
      "{设备}",
      "{食材}",
      "{操作}",
      "{结果}",
      "{场景}",
      "{画面比例}",
      "{镜头}",
      "{节奏}",
      "{时长}",
      "{输出格式}"
    ],
    "defaults": {
      "设备": "待定",
      "食材": "待定",
      "操作": "待定",
      "结果": "待定",
      "场景": "夜晚书桌",
      "画面比例": "9:16",
      "镜头": "缓慢推进",
      "节奏": "待定",
      "时长": "8 秒",
      "输出格式": "待定"
    }
  },
  "provenance": {
    "source": "v2 5000 visual copy-ready templates / original platform-adapted library",
    "authorName": "",
    "authorUrl": "",
    "sourceUrl": "",
    "licenseType": "",
    "licenseConfirmed": false,
    "submissionIssueNumber": null
  },
  "proof": null,
  "publication": {
    "status": "published",
    "featured": false,
    "copyReady": true,
    "qualityScore": 92,
    "qualityLevel": "professional",
    "verifiedAt": "2026-05-21",
    "collectionIds": [],
    "createdAt": "",
    "updatedAt": "",
    "publishedAt": ""
  }
}
