{
  "schemaVersion": 1,
  "id": "community-task-film-aigc-visual-movie-poster-concept-poster",
  "content": {
    "title": "社区分享 · 影视 / AIGC 视觉创作 · 电影海报 · 生成概念海报",
    "summary": "面向「影视 / AIGC 视觉创作 / 电影海报」的社区分享提示词，可直接用于「生成概念海报」任务。",
    "preview": "",
    "prompt": "适用工具：ChatGPT / GPT Image\n适用场景：影视 / AIGC 视觉创作 / 电影海报 / 生成概念海报\n输入变量：{{主题/对象}}、{{目标受众}}、{{使用场景}}、{{约束条件}}、{{输出格式}}、{{画面比例}}、{{风格参考}}、{{负面词}}\n\n复制即用提示词：\n你是一名熟悉中文互联网业务的 AI 提示词助手，请基于我给出的资料完成「生成概念海报」任务。\n\n任务背景：\n- 所属分类：影视 / AIGC 视觉创作\n- 当前场景：电影海报\n- 目标任务：生成概念海报\n- 主题或对象：{{主题/对象}}\n- 目标受众：{{目标受众}}\n- 使用场景：{{使用场景}}\n- 限制条件：{{约束条件}}\n\n执行步骤：\n1. 先复述你理解的任务目标，指出还缺哪些关键信息；如果信息不足，用合理假设补齐并标注“假设”。\n2. 根据「电影海报」的常见工作流程，拆成 3 到 6 个可执行步骤，不要只给空泛建议。\n3. 围绕「生成概念海报」产出可直接使用的成品内容，内容要具体、有场景、有判断标准。\n4. 如果涉及内容、营销、销售、产品或运营，不夸大效果，不使用绝对化承诺，不冒用真实品牌或名人。\n5. 如果涉及数据或复盘，区分事实、推断和下一步验证，不把相关性写成因果结论。\n\n输出格式：\n输出一条可直接用于图像模型的中文提示词，必须包含主体、场景、动作、构图、镜头、光线、色彩、材质、文字区、画幅比例和负面词。\n请按以下结构输出：\n- 任务理解\n- 输入信息整理\n- 可直接使用的成品\n- 可替换变量\n- 检查清单\n- 常见失败点\n- 下一步优化建议\n\n质量标准：\n- 结果必须能复制后直接使用，不能只写“建议你优化”。\n- 内容必须符合中文表达习惯，短句优先，避免堆砌黑话。\n- 每个结论都要能追溯到输入变量或明确假设。\n- 输出格式稳定，便于用户继续改写、复制或发布到社区。\n\n参数/设置建议：\n- 如果用于 ChatGPT、DeepSeek、Claude 或 Gemini，先粘贴完整背景，再补充真实资料。\n- 如果用于图像或视频工具，请把主体、场景、镜头、动作、风格、比例和负面约束拆开写。\n- 如果结果过泛，追加“请给出 3 个不同版本，并说明适用场景”。\n\n迭代方法：\n- 第一轮先要结构和方向，第二轮补充真实资料，第三轮要求压缩成可发布版本。\n- 对不满意的部分，不要整段重写，指出具体问题：太长、太虚、缺少卖点、语气不对或格式不稳定。\n\n常见失败修正：\n- 如果输出太空泛：要求加入具体对象、平台、受众、约束和例子。\n- 如果输出太像广告：要求降低承诺、补充证据和风险提醒。\n- 如果输出不可复制：要求改成固定栏目、表格或编号清单。\n\n边界提醒：\n- 不复制第三方提示词原文，不冒用真实品牌、名人、受保护 IP 或私密资料。\n- 不生成违法、欺诈、规避审核、医疗诊断、金融收益承诺或侵犯隐私的内容。\n- 本提示词用于社区免费分享和学习，发布前请根据真实业务再检查一遍。",
    "copyPrompt": "",
    "language": "zh-CN"
  },
  "classification": {
    "category": "影视 / AIGC 视觉创作 / 电影海报 / 生成概念海报",
    "department": "",
    "scenario": "",
    "task": "",
    "modality": "图像",
    "useCase": "生成概念海报",
    "aspectRatio": "",
    "difficulty": "入门",
    "tags": [
      "工具:ChatGPT / GPT Image",
      "模态:图像",
      "用途:生成概念海报",
      "难度:入门",
      "社区分享",
      "免费复制",
      "原创种子"
    ],
    "styleTags": [],
    "seoKeywords": [
      "图像",
      "ChatGPT / GPT Image",
      "生成概念海报",
      "影视",
      "AIGC",
      "视觉创作",
      "电影海报",
      "工具:ChatGPT / GPT Image",
      "模态:图像",
      "用途:生成概念海报"
    ]
  },
  "model": {
    "tool": "ChatGPT / GPT Image",
    "name": "universal"
  },
  "variables": {
    "names": [
      "{主题/对象}",
      "{目标受众}",
      "{使用场景}",
      "{约束条件}",
      "{输出格式}",
      "{画面比例}",
      "{风格参考}",
      "{负面词}"
    ],
    "defaults": {}
  },
  "provenance": {
    "source": "站内原创生成种子，不复制外部提示词原文",
    "authorName": "",
    "authorUrl": "",
    "sourceUrl": "",
    "licenseType": "",
    "licenseConfirmed": false,
    "submissionIssueNumber": null
  },
  "proof": {
    "assetPath": "proofs/generated/community-task-film-aigc-visual-movie-poster-concept-poster.webp",
    "type": "GPT Image 效果预览",
    "model": "ChatGPT web / GPT Image",
    "testedAt": "2026-05-24",
    "resultNote": "预览图来自 public/proofs/generated，按提示词 ID 精确匹配。",
    "evidenceLevel": "generated-preview"
  },
  "publication": {
    "status": "published-proofed",
    "featured": true,
    "copyReady": true,
    "qualityScore": 98,
    "qualityLevel": "professional",
    "verifiedAt": "2026-05-24",
    "collectionIds": [
      "brand-campaign-visual"
    ],
    "createdAt": "",
    "updatedAt": "",
    "publishedAt": ""
  }
}
