{
  "schemaVersion": 1,
  "id": "v2-image-canva-editorial-illustration-hero",
  "content": {
    "title": "Canva Magic Media · 专栏配图插画 · 主视觉版",
    "summary": "Canva Magic Media 适用的「专栏配图插画」主视觉版：为文章或报告生成原创概念插画，避免模仿特定艺术家，包含复制即用正文、可替换关键词、平台参数、失败修正和安全边界。",
    "preview": "",
    "prompt": "请使用 Canva Magic Media 生成一张「专栏配图插画」图片。画面主体是 {文章主题}，使用场景为 {隐喻}，重点呈现 {人物或物件}，整体风格、情绪和色彩氛围为 {风格}，采用 {画面比例} 构图。主体居中，第一眼识别产品或角色，适合首页和广告首图。 构图需要有清晰视觉中心、前中后景层次、可见材质细节、可控光影和后期排版留白。文字只允许出现用户明确填写的短句，其他区域保持无文字。输出必须商业安全、原创、可直接用于图片生成。",
    "copyPrompt": "",
    "language": "zh-CN"
  },
  "classification": {
    "category": "图像提示词 / Canva",
    "department": "",
    "scenario": "",
    "task": "",
    "modality": "图像",
    "useCase": "专栏配图插画",
    "aspectRatio": "{画面比例}",
    "difficulty": "入门",
    "tags": [
      "工具:Canva Magic Media",
      "模态:图像",
      "用途:专栏配图插画",
      "难度:入门",
      "官方结构参考:否",
      "一键复制模板",
      "可替换关键词",
      "图片视频生成",
      "canva",
      "editorial-illustration"
    ],
    "styleTags": [],
    "seoKeywords": [
      "图像",
      "Canva Magic Media",
      "专栏配图插画",
      "图像提示词",
      "Canva",
      "工具:Canva Magic Media",
      "模态:图像",
      "用途:专栏配图插画",
      "难度:入门",
      "官方结构参考:否"
    ]
  },
  "model": {
    "tool": "Canva Magic Media",
    "name": "canva"
  },
  "variables": {
    "names": [
      "{文章主题}",
      "{隐喻}",
      "{人物或物件}",
      "{风格}",
      "{版面}",
      "{画面比例}",
      "{情绪}",
      "{色彩}",
      "{目标平台}",
      "{输出格式}"
    ],
    "defaults": {
      "文章主题": "待定",
      "隐喻": "待定",
      "人物或物件": "待定",
      "风格": "待定",
      "版面": "待定",
      "画面比例": "4:5",
      "情绪": "待定",
      "色彩": "待定",
      "目标平台": "待定",
      "输出格式": "待定"
    }
  },
  "provenance": {
    "source": "v2 5000 visual copy-ready templates / original platform-adapted library",
    "authorName": "",
    "authorUrl": "",
    "sourceUrl": "",
    "licenseType": "",
    "licenseConfirmed": false,
    "submissionIssueNumber": null
  },
  "proof": null,
  "publication": {
    "status": "published",
    "featured": false,
    "copyReady": true,
    "qualityScore": 90,
    "qualityLevel": "professional",
    "verifiedAt": "2026-05-21",
    "collectionIds": [],
    "createdAt": "",
    "updatedAt": "",
    "publishedAt": ""
  }
}
