{
  "schemaVersion": 1,
  "id": "v2-video-sora-workspace-routine-single-shot",
  "content": {
    "title": "Sora · 工作流场景短片 · 单镜头版",
    "summary": "Sora 适用的「工作流场景短片」单镜头版：展示创作者或团队从输入到输出的工作过程，包含复制即用正文、可替换关键词、平台参数、失败修正和安全边界。",
    "preview": "",
    "prompt": "请使用 Sora 生成一段「工作流场景短片」视频。主体是 {角色}，发生在 {工具}，核心动作围绕 {输入材料} 展开，镜头使用 {输出成果} 或同等稳定运镜，画幅为 {比例}。一个连续镜头完成动作，减少跳帧和身份漂移。 前 3 秒交代主体和目标，中段展示动作变化，结尾停在可作为封面的稳定画面。保持主体、服装、道具、产品外观、光线和空间方向一致；不要突然切换场景、不要身份漂移、不要生成随机文字。",
    "copyPrompt": "",
    "language": "zh-CN"
  },
  "classification": {
    "category": "视频提示词 / Sora",
    "department": "",
    "scenario": "",
    "task": "",
    "modality": "视频",
    "useCase": "工作流场景短片",
    "aspectRatio": "{画面比例}",
    "difficulty": "中级",
    "tags": [
      "工具:Sora",
      "模态:视频",
      "用途:工作流场景短片",
      "难度:中级",
      "官方结构参考:否",
      "一键复制模板",
      "可替换关键词",
      "图片视频生成",
      "sora",
      "workspace-routine"
    ],
    "styleTags": [],
    "seoKeywords": [
      "视频",
      "Sora",
      "工作流场景短片",
      "视频提示词",
      "工具:Sora",
      "模态:视频",
      "用途:工作流场景短片",
      "难度:中级",
      "官方结构参考:否",
      "一键复制模板"
    ]
  },
  "model": {
    "tool": "Sora",
    "name": "sora"
  },
  "variables": {
    "names": [
      "{角色}",
      "{工具}",
      "{输入材料}",
      "{输出成果}",
      "{镜头}",
      "{比例}",
      "{节奏}",
      "{字幕}",
      "{时长}",
      "{输出格式}"
    ],
    "defaults": {
      "角色": "待定",
      "工具": "待定",
      "输入材料": "待定",
      "输出成果": "待定",
      "镜头": "缓慢推进",
      "比例": "9:16",
      "节奏": "待定",
      "字幕": "待定",
      "时长": "8 秒",
      "输出格式": "待定"
    }
  },
  "provenance": {
    "source": "v2 5000 visual copy-ready templates / original platform-adapted library",
    "authorName": "",
    "authorUrl": "",
    "sourceUrl": "",
    "licenseType": "",
    "licenseConfirmed": false,
    "submissionIssueNumber": null
  },
  "proof": null,
  "publication": {
    "status": "published",
    "featured": true,
    "copyReady": true,
    "qualityScore": 92,
    "qualityLevel": "professional",
    "verifiedAt": "2026-05-21",
    "collectionIds": [
      "video-motion-shot"
    ],
    "createdAt": "",
    "updatedAt": "",
    "publishedAt": ""
  }
}
