{
  "schemaVersion": 1,
  "id": "v2-video-kling-city-night-loop",
  "content": {
    "title": "可灵 Kling · 城市夜景氛围视频 · 循环动效版",
    "summary": "可灵 Kling 适用的「城市夜景氛围视频」循环动效版：生成城市夜景、霓虹、雨水或车流的氛围镜头，包含复制即用正文、可替换关键词、平台参数、失败修正和安全边界。",
    "preview": "",
    "prompt": "请使用 可灵 Kling 生成一段「城市夜景氛围视频」视频。主体是 {城市类型}，发生在 {天气}，核心动作围绕 {主体} 展开，镜头使用 {镜头运动} 或同等稳定运镜，画幅为 {比例}。首尾状态自然衔接，适合商品卡片、背景视频和社媒循环。 前 3 秒交代主体和目标，中段展示动作变化，结尾停在可作为封面的稳定画面。保持主体、服装、道具、产品外观、光线和空间方向一致；不要突然切换场景、不要身份漂移、不要生成随机文字。",
    "copyPrompt": "",
    "language": "zh-CN"
  },
  "classification": {
    "category": "视频提示词 / 可灵",
    "department": "",
    "scenario": "",
    "task": "",
    "modality": "视频",
    "useCase": "城市夜景氛围视频",
    "aspectRatio": "{画面比例}",
    "difficulty": "入门",
    "tags": [
      "工具:可灵 Kling",
      "模态:视频",
      "用途:城市夜景氛围视频",
      "难度:入门",
      "官方结构参考:否",
      "一键复制模板",
      "可替换关键词",
      "图片视频生成",
      "kling",
      "city-night"
    ],
    "styleTags": [],
    "seoKeywords": [
      "视频",
      "可灵 Kling",
      "城市夜景氛围视频",
      "视频提示词",
      "可灵",
      "工具:可灵 Kling",
      "模态:视频",
      "用途:城市夜景氛围视频",
      "难度:入门",
      "官方结构参考:否"
    ]
  },
  "model": {
    "tool": "可灵 Kling",
    "name": "kling"
  },
  "variables": {
    "names": [
      "{城市类型}",
      "{天气}",
      "{主体}",
      "{镜头运动}",
      "{光线}",
      "{比例}",
      "{时长}",
      "{情绪}",
      "{输出格式}"
    ],
    "defaults": {
      "城市类型": "待定",
      "天气": "待定",
      "主体": "原创成年角色与产品",
      "镜头运动": "slow dolly in",
      "光线": "暖色桌面灯与冷色环境对比",
      "比例": "9:16",
      "时长": "8 秒",
      "情绪": "待定",
      "输出格式": "待定"
    }
  },
  "provenance": {
    "source": "v2 5000 visual copy-ready templates / original platform-adapted library",
    "authorName": "",
    "authorUrl": "",
    "sourceUrl": "",
    "licenseType": "",
    "licenseConfirmed": false,
    "submissionIssueNumber": null
  },
  "proof": null,
  "publication": {
    "status": "published",
    "featured": false,
    "copyReady": true,
    "qualityScore": 92,
    "qualityLevel": "professional",
    "verifiedAt": "2026-05-21",
    "collectionIds": [],
    "createdAt": "",
    "updatedAt": "",
    "publishedAt": ""
  }
}
