{
  "schemaVersion": 1,
  "id": "v2-video-luma-architecture-concept-loop",
  "content": {
    "title": "Luma Dream Machine · 建筑概念漫游 · 循环动效版",
    "summary": "Luma Dream Machine 适用的「建筑概念漫游」循环动效版：展示原创建筑体量、入口、材质和空间体验，包含复制即用正文、可替换关键词、平台参数、失败修正和安全边界。",
    "preview": "",
    "prompt": "请使用 Luma Dream Machine 生成一段「建筑概念漫游」视频。主体是 {建筑类型}，发生在 {场地}，核心动作围绕 {材质} 展开，镜头使用 {镜头路径} 或同等稳定运镜，画幅为 {比例}。首尾状态自然衔接，适合商品卡片、背景视频和社媒循环。 前 3 秒交代主体和目标，中段展示动作变化，结尾停在可作为封面的稳定画面。保持主体、服装、道具、产品外观、光线和空间方向一致；不要突然切换场景、不要身份漂移、不要生成随机文字。",
    "copyPrompt": "",
    "language": "zh-CN"
  },
  "classification": {
    "category": "视频提示词 / Luma",
    "department": "",
    "scenario": "",
    "task": "",
    "modality": "视频",
    "useCase": "建筑概念漫游",
    "aspectRatio": "{画面比例}",
    "difficulty": "进阶",
    "tags": [
      "工具:Luma Dream Machine",
      "模态:视频",
      "用途:建筑概念漫游",
      "难度:进阶",
      "官方结构参考:否",
      "一键复制模板",
      "可替换关键词",
      "图片视频生成",
      "luma",
      "architecture-concept"
    ],
    "styleTags": [],
    "seoKeywords": [
      "视频",
      "Luma Dream Machine",
      "建筑概念漫游",
      "视频提示词",
      "Luma",
      "工具:Luma Dream Machine",
      "模态:视频",
      "用途:建筑概念漫游",
      "难度:进阶",
      "官方结构参考:否"
    ]
  },
  "model": {
    "tool": "Luma Dream Machine",
    "name": "luma"
  },
  "variables": {
    "names": [
      "{建筑类型}",
      "{场地}",
      "{材质}",
      "{镜头路径}",
      "{光线}",
      "{比例}",
      "{人流}",
      "{结尾}",
      "{时长}",
      "{输出格式}"
    ],
    "defaults": {
      "建筑类型": "待定",
      "场地": "待定",
      "材质": "待定",
      "镜头路径": "待定",
      "光线": "暖色桌面灯与冷色环境对比",
      "比例": "9:16",
      "人流": "待定",
      "结尾": "待定",
      "时长": "8 秒",
      "输出格式": "待定"
    }
  },
  "provenance": {
    "source": "v2 5000 visual copy-ready templates / original platform-adapted library",
    "authorName": "",
    "authorUrl": "",
    "sourceUrl": "",
    "licenseType": "",
    "licenseConfirmed": false,
    "submissionIssueNumber": null
  },
  "proof": null,
  "publication": {
    "status": "published",
    "featured": false,
    "copyReady": true,
    "qualityScore": 92,
    "qualityLevel": "professional",
    "verifiedAt": "2026-05-21",
    "collectionIds": [],
    "createdAt": "",
    "updatedAt": "",
    "publishedAt": ""
  }
}
