{
  "schemaVersion": 1,
  "id": "v2-video-jimeng-seedance-object-to-scene-three-act",
  "content": {
    "title": "即梦 / Seedance · 物体引出场景 · 三段式版",
    "summary": "即梦 / Seedance 适用的「物体引出场景」三段式版：从一个物件特写自然转场到完整使用场景，包含复制即用正文、可替换关键词、平台参数、失败修正和安全边界。",
    "preview": "",
    "prompt": "请使用 即梦 / Seedance 生成一段「物体引出场景」视频。主体是 {物件}，发生在 {场景}，核心动作围绕 {转场方式} 展开，镜头使用 {镜头运动} 或同等稳定运镜，画幅为 {画面比例}。开头交代问题，中段展示变化，结尾形成可截图的稳定画面。 前 3 秒交代主体和目标，中段展示动作变化，结尾停在可作为封面的稳定画面。保持主体、服装、道具、产品外观、光线和空间方向一致；不要突然切换场景、不要身份漂移、不要生成随机文字。",
    "copyPrompt": "",
    "language": "zh-CN"
  },
  "classification": {
    "category": "视频提示词 / 即梦 Seedance",
    "department": "",
    "scenario": "",
    "task": "",
    "modality": "视频",
    "useCase": "物体引出场景",
    "aspectRatio": "{画面比例}",
    "difficulty": "进阶",
    "tags": [
      "工具:即梦 / Seedance",
      "模态:视频",
      "用途:物体引出场景",
      "难度:进阶",
      "官方结构参考:否",
      "一键复制模板",
      "可替换关键词",
      "图片视频生成",
      "jimeng-seedance",
      "object-to-scene"
    ],
    "styleTags": [],
    "seoKeywords": [
      "视频",
      "即梦 / Seedance",
      "物体引出场景",
      "视频提示词",
      "即梦",
      "Seedance",
      "工具:即梦 / Seedance",
      "模态:视频",
      "用途:物体引出场景",
      "难度:进阶"
    ]
  },
  "model": {
    "tool": "即梦 / Seedance",
    "name": "jimeng-seedance"
  },
  "variables": {
    "names": [
      "{物件}",
      "{场景}",
      "{转场方式}",
      "{镜头运动}",
      "{画面比例}",
      "{光线}",
      "{动作}",
      "{结尾}",
      "{时长}",
      "{输出格式}"
    ],
    "defaults": {
      "物件": "待定",
      "场景": "夜晚书桌",
      "转场方式": "待定",
      "镜头运动": "slow dolly in",
      "画面比例": "9:16",
      "光线": "暖色桌面灯与冷色环境对比",
      "动作": "从关闭到点亮，再切到使用细节",
      "结尾": "待定",
      "时长": "8 秒",
      "输出格式": "待定"
    }
  },
  "provenance": {
    "source": "v2 5000 visual copy-ready templates / original platform-adapted library",
    "authorName": "",
    "authorUrl": "",
    "sourceUrl": "",
    "licenseType": "",
    "licenseConfirmed": false,
    "submissionIssueNumber": null
  },
  "proof": null,
  "publication": {
    "status": "published",
    "featured": false,
    "copyReady": true,
    "qualityScore": 92,
    "qualityLevel": "professional",
    "verifiedAt": "2026-05-21",
    "collectionIds": [],
    "createdAt": "",
    "updatedAt": "",
    "publishedAt": ""
  }
}
