{
  "schemaVersion": 1,
  "id": "v2-video-runway-event-promo-storyboard",
  "content": {
    "title": "Runway · 活动预热视频 · 分镜版",
    "summary": "Runway 适用的「活动预热视频」分镜版：用场地、人物、议程和收尾信息组成预热短片，包含复制即用正文、可替换关键词、平台参数、失败修正和安全边界。",
    "preview": "",
    "prompt": "请使用 Runway 生成一段「活动预热视频」视频。主体是 {活动}，发生在 {场地}，核心动作围绕 {观众} 展开，镜头使用 {亮点} 或同等稳定运镜，画幅为 {画面比例}。拆成 3 到 5 个镜头，每个镜头只承担一个动作目标。 前 3 秒交代主体和目标，中段展示动作变化，结尾停在可作为封面的稳定画面。保持主体、服装、道具、产品外观、光线和空间方向一致；不要突然切换场景、不要身份漂移、不要生成随机文字。",
    "copyPrompt": "",
    "language": "zh-CN"
  },
  "classification": {
    "category": "视频提示词 / Runway",
    "department": "",
    "scenario": "",
    "task": "",
    "modality": "视频",
    "useCase": "活动预热视频",
    "aspectRatio": "{画面比例}",
    "difficulty": "进阶",
    "tags": [
      "工具:Runway",
      "模态:视频",
      "用途:活动预热视频",
      "难度:进阶",
      "官方结构参考:否",
      "一键复制模板",
      "可替换关键词",
      "图片视频生成",
      "runway",
      "event-promo"
    ],
    "styleTags": [],
    "seoKeywords": [
      "视频",
      "Runway",
      "活动预热视频",
      "视频提示词",
      "工具:Runway",
      "模态:视频",
      "用途:活动预热视频",
      "难度:进阶",
      "官方结构参考:否",
      "一键复制模板"
    ]
  },
  "model": {
    "tool": "Runway",
    "name": "runway"
  },
  "variables": {
    "names": [
      "{活动}",
      "{场地}",
      "{观众}",
      "{亮点}",
      "{文字策略}",
      "{画面比例}",
      "{节奏}",
      "{CTA}",
      "{时长}",
      "{输出格式}"
    ],
    "defaults": {
      "活动": "待定",
      "场地": "待定",
      "观众": "待定",
      "亮点": "待定",
      "文字策略": "待定",
      "画面比例": "9:16",
      "节奏": "待定",
      "CTA": "待定",
      "时长": "8 秒",
      "输出格式": "待定"
    }
  },
  "provenance": {
    "source": "v2 5000 visual copy-ready templates / original platform-adapted library",
    "authorName": "",
    "authorUrl": "",
    "sourceUrl": "",
    "licenseType": "",
    "licenseConfirmed": false,
    "submissionIssueNumber": null
  },
  "proof": null,
  "publication": {
    "status": "published",
    "featured": false,
    "copyReady": true,
    "qualityScore": 92,
    "qualityLevel": "professional",
    "verifiedAt": "2026-05-21",
    "collectionIds": [],
    "createdAt": "",
    "updatedAt": "",
    "publishedAt": ""
  }
}
